{
  "title": "Spaceballs",
  "media_type": "film",
  "release_date": "1987-06-26",
  "description": "Spaceballs is a science fiction parody film directed by Mel Brooks, and written by Brooks, Thomas Meeham, and Ronny Graham. It premiered at cinemas in the USA on 26 June 1987.",
  "image_url": null,
  "source_url": "https://spaceballs.fandom.com/wiki/Spaceballs",
  "trivia": [],
  "citations": []
}
